"location_id","location_number_getty","getty_name","nation_name","nation_name_alpha","official_nation_name","sovereignty","code_alpha2","code_alpha3","code_numeric","code_iso"
246,6536160,South Sudan,South Sudan,South Sudan,The Republic of South Sudan,UN member state,SS,SSD,728,ISO 3166-2:SS
247,6584482,Western Sahara,Western Sahara,Western Sahara,The Sahrawi Arab Democratic Republic,Disputed,EH,ESH,732,ISO 3166-2:EH
248,7615132,British Indian Ocean Territory,British Indian Ocean Territory,British Indian Ocean Territory (the),The British Indian Ocean Territory,United Kingdom,IO,IOT,86,ISO 3166-2:IO
249,8705791,Svalbard and Jan Mayen,Jan Mayen,Jan Mayen,Svalbard and Jan Mayen,Norway,SJ,SJM,744,ISO 3166-2:SJ
250,8784827,Palestine,State of Palestine,"Palestine, State of",The State of Palestine,UN observer state,PS,PSE,275,ISO 3166-2:PS
251,11400128,Cyprus,Cyprus,Cyprus,The Republic of Cyprus,UN member state,CY,CYP,196,ISO 3166-2:CY
252,17047572,South Georgia and the South Sandwich Islands,South Georgia and the South Sandwich Islands,South Georgia and the South Sandwich Islands,South Georgia and the South Sandwich Islands,United Kingdom,GS,SGS,239,ISO 3166-2:GS
253,18752876,Saint Martin,Collectivity of Saint Martin,Saint Martin (French part),The Collectivity of Saint-Martin,France,MF,MAF,663,ISO 3166-2:MF
254,19760695,Saint Helena Ascension and Tristan da Cunha,"Saint Helena, Ascension Island and Tristan da Cunha","Saint Helena, Ascension Island and Tristan da Cunha","Saint Helena, Ascension and Tristan da Cunha",United Kingdom,SH,SHN,654,ISO 3166-2:SH
255,,Montserrat,Montserrat,Montserrat,Montserrat,United Kingdom,MS,MSR,500,ISO 3166-2:MS
256,,Pitcairn Islands,Pitcairn Islands,Pitcairn,"The Pitcairn, Henderson, Ducie and Oeno Islands",United Kingdom,PN,PCN,612,ISO 3166-2:PN
257,,Bouvet Island,Bouvet Island,Bouvet Island,Bouvet Island,Norway,BV,BVT,74,ISO 3166-2:BV
258,,United States Minor Outlying Islands,United States Minor Outlying Islands,United States Minor Outlying Islands (the),"Baker Island, Howland Island, Jarvis Island, Johnston Atoll, Kingman Reef, Midway Atoll, Navassa Island, Palmyra Atoll, and Wake Island",United States,UM,UMI,581,ISO 3166-2:UM
259,,Saint Pierre and Miquelon,Saint Pierre and Miquelon,Saint Pierre and Miquelon,The Overseas Collectivity of Saint-Pierre and Miquelon,France,PM,SPM,666,ISO 3166-2:PM
260,,Heard Island and McDonald Islands,Heard Island and McDonald Islands,Heard Island and McDonald Islands,The Territory of Heard Island and McDonald Islands,Australia,HM,HMD,334,ISO 3166-2:HM
